{
  "$schema": "https://json-schema.org/draft/2020-12/schema",
  "title": "领域上下文",
  "type": "object",
  "required": [
    "project",
    "actors",
    "facts",
    "terms",
    "sample_id"
  ],
  "properties": {
    "sample_id": {
      "type": "string",
      "description": "样例资料编号，供审计与交换追溯"
    },
    "project": {
      "type": "string",
      "description": "项目名称"
    },
    "actors": {
      "type": "array",
      "items": {
        "type": "string"
      },
      "description": "参与角色"
    },
    "facts": {
      "type": "array",
      "items": {
        "type": "string"
      },
      "description": "已确认事实"
    },
    "terms": {
      "type": "object",
      "additionalProperties": {
        "type": "string"
      },
      "description": "领域术语"
    }
  },
  "additionalProperties": false
}
