{
  "sample_id": "CTX-092204-017",
  "project": "民生规划承诺兑现",
  "actors": [
    "市民（公众查阅）",
    "政策局与部门（房屋局、房屋署、屋宇署、医务卫生局、医管局、民政及青年事务局等）",
    "监督人员（重放判定与证据复核）",
    "社区组织（凭授权反馈去标识个案）",
    "承诺兑现服务运营方"
  ],
  "facts": [
    "五年规划量化公营房屋 196000 个单位、平均轮候时间、约 20000 处劣质劏房治理、3000 张公立医院病床、康健中心受惠规模与 80000 名青年受惠目标",
    "规划与年度施政方案相互衔接：年度方案可调整实现路径，不得改写已锁定的五年目标",
    "统计口径变化必须保留可比桥接，历史值按新口径重述",
    "编制过程收到超过 17000 份公众意见，意见主题关联回具体目标",
    "跨部门数据迟到或覆盖率不足时，当前进度标明置信状态",
    "每个判定绑定证据快照哈希、规则版本与判定时点，可重放复核",
    "社区组织只能反馈获居民授权的去标识个案；未公开选址与个人申请信息不得外泄"
  ],
  "terms": {
    "目标锁定": "五年目标值锁定后，年度方案只能调整路径，改写尝试拒绝并留痕",
    "量化里程碑": "按季度拆解的可量化节点，关联预算、责任机构、空间项目与计划/预测日期",
    "证据快照": "某时点节点观测值及其来源、口径、覆盖率、迟到标记与 SHA-256 哈希",
    "口径桥接": "指标口径变化时新旧版本间的换算系数与历史重述序列",
    "置信状态": "定稿 / 初步 / 估算 / 陈旧 / 缺报，反映当前进度数字的可信程度",
    "时点重放": "按证据送达时间与修订生效时间重现任一时点的按期/预警/偏离判定",
    "授权反馈": "社区组织凭令牌在授权议题与地区范围内提交的去标识居民个案"
  }
}
